"","authorID","groupID","author_name","author_order","address","university","department","postal_code","city","state","country","RP_address","RI","OI","UT","refID","PT","PY","PU","year"
"622",622,622,"Burrows, Michael T.",2,"Scottish Assoc Marine Sci, Dunstaffnage Marine Lab, Oban PA37 1QA, Argyll, Scotland.","scottish assoc marine sci","dunstaffnage marine lab","pa37 1qa","oban ","argyll","scotland",NA,"D-9844-2013","0000-0003-4620-5899","WOS:000282654700012",152,"J","2010","WILEY",2010
"623",623,623,"Findlay, Helen S.",1,"Plymouth Marine Lab, Plymouth PL1 3DH, Devon, England.","plymouth marine lab",NA,"pl1 3dh","plymouth ","devon","england",NA,NA,NA,"WOS:000282654700012",152,"J","2010","WILEY",2010
"624",624,624,"Kendall, Michael A.",3,"Plymouth Marine Lab, Plymouth PL1 3DH, Devon, England.","plymouth marine lab",NA,"pl1 3dh","plymouth ","devon","england",NA,NA,NA,"WOS:000282654700012",152,"J","2010","WILEY",2010
"625",625,625,"Spicer, John I.",4,"Univ Plymouth, Marine Biol & Ecol Res Ctr, Sch Marine Sci & Engn, Plymouth PL4 8AA, Devon, England.","univ plymouth","marine biol & ecol res ctr","pl4 8aa","plymouth ","devon","england",NA,NA,NA,"WOS:000282654700012",152,"J","2010","WILEY",2010
"626",626,626,"Widdicombe, Stephen",5,"Plymouth Marine Lab, Plymouth PL1 3DH, Devon, England.","plymouth marine lab",NA,"pl1 3dh","plymouth ","devon","england",NA,NA,NA,"WOS:000282654700012",152,"J","2010","WILEY",2010
"627",627,627,"Amstrup, Steve C.",5,"US Geol Survey, Alaska Sci Ctr, Anchorage, AK 99508 USA.","us geol survey","alaska sci ctr","99508","anchorage","ak","usa",NA,NA,NA,"WOS:000282654700008",153,"J","2010","WILEY",2010
"628",628,628,"Caswell, Hal",2,"Woods Hole Oceanog Inst, Biol Dept MS 34, Woods Hole, MA 02543 USA.","woods hole oceanog inst","biol dept ms 34","02543","woods hole","ma","usa",NA,NA,"0000-0003-4394-6894","WOS:000282654700008",153,"J","2010","WILEY",2010
"629",629,629,"Hunter, Christine M.",1,"Univ Alaska, Inst Arctic Biol, Dept Biol & Wildlife, Fairbanks, AK 99775 USA.","univ alaska","dept biol & wildlife","99775","fairbanks","ak","usa",NA,NA,NA,"WOS:000282654700008",153,"J","2010","WILEY",2010
"630",630,630,"Regehr, Eric V.",4,"US Geol Survey, Alaska Sci Ctr, Anchorage, AK 99508 USA.","us geol survey","alaska sci ctr","99508","anchorage","ak","usa",NA,NA,NA,"WOS:000282654700008",153,"J","2010","WILEY",2010
"631",631,631,"Runge, Michael C.",3,"US Geol Survey, Patuxent Wildlife Res Ctr, Laurel, MD 20708 USA.","us geol survey","patuxent wildlife res ctr","20708","laurel","md","usa",NA,"E-7331-2011","0000-0002-8081-536X","WOS:000282654700008",153,"J","2010","WILEY",2010
"632",632,632,"Stirling, Ian",6,"Canadian Wildlife Serv, Edmonton, AB T6H 3S5, Canada.","canadian wildlife serv","edmonton"," t6h 3s5","ab",NA,"canada",NA,NA,NA,"WOS:000282654700008",153,"J","2010","WILEY",2010
"633",633,633,"Heppell, Selina S.",2,"Oregon State Univ, Dept Fisheries & Wildlife, Corvallis, OR 97331 USA.","oregon state univ","dept fisheries & wildlife","97331","corvallis","or","usa",NA,NA,NA,"WOS:000282654700006",154,"J","2010","WILEY",2010
"634",634,634,"Marshall, Dustin J.",1,"Univ Queensland, Sch Biol Sci, Brisbane, Qld 4072, Australia.","univ queensland","sch biol sci",NA,"brisbane","qld ","australia",NA,"C-3450-2016","0000-0001-6651-6219","WOS:000282654700006",154,"J","2010","WILEY",2010
"635",635,634,"Marshall, Dustin J.",1,"Univ Queensland, Sch Biol Sci, Brisbane, Qld 4072, Australia.","univ queensland","sch biol sci",NA,"brisbane","qld ","australia",NA,"A-4185-2008","0000-0001-6651-6219","WOS:000282654700006",154,"J","2010","WILEY",2010
"636",636,230,"Munch, Stephan B.",3,"SUNY Stony Brook, Dept Ecol & Evolut, Stony Brook, NY 11794 USA.","suny stony brook","dept ecol & evolut","11794","stony brook","ny","usa",NA,NA,NA,"WOS:000282654700006",154,"J","2010","WILEY",2010
"637",637,301,"Warner, Robert R.",4,"Univ Calif Santa Barbara, Dept Ecol Evolut & Marine Biol, Santa Barbara, CA 93106 USA.","univ calif santa barbara","dept ecol evolut & marine biol","93106","santa barbara","ca","usa",NA,"M-5342-2013","0000-0002-3299-5685","WOS:000282654700006",154,"J","2010","WILEY",2010
"638",638,638,"Boutin, Stan",2,"Univ Alberta, Dept Biol Sci, Edmonton, AB T6G 2E9, Canada.","univ alberta","dept biol sci"," t6g 2e9","ab",NA,"canada",NA,"A-2619-2014","0000-0001-6317-038X","WOS:000281698400023",155,"J","2010","WILEY",2010
"639",639,639,"Fletcher, Quinn E.",1,"McGill Univ, Dept Nat Resource Sci, Ste Anne De Bellevue, PQ H9X 3V9, Canada.","mcgill univ","dept nat resource sci"," h9x 3v9","pq",NA,"canada",NA,NA,NA,"WOS:000281698400023",155,"J","2010","WILEY",2010
"640",640,640,"Humphries, Murray M.",7,"McGill Univ, Dept Nat Resource Sci, Ste Anne De Bellevue, PQ H9X 3V9, Canada.","mcgill univ","dept nat resource sci"," h9x 3v9","pq",NA,"canada",NA,NA,NA,"WOS:000281698400023",155,"J","2010","WILEY",2010
"641",641,641,"Krebs, Charles J.",6,"Univ British Columbia, Dept Zool, Vancouver, BC V6T 1Z4, Canada.","univ british columbia","dept zool"," v6t 1z4","bc",NA,"canada",NA,NA,NA,"WOS:000281698400023",155,"J","2010","WILEY",2010
"642",642,642,"LaMontagne, Jalene M.",4,"Univ Alberta, Dept Biol Sci, Edmonton, AB T6G 2E9, Canada.","univ alberta","dept biol sci"," t6g 2e9","ab",NA,"canada",NA,NA,"0000-0001-7713-8591","WOS:000281698400023",155,"J","2010","WILEY",2010
"643",643,643,"Lane, Jeffrey E.",3,"Univ Alberta, Dept Biol Sci, Edmonton, AB T6G 2E9, Canada.","univ alberta","dept biol sci"," t6g 2e9","ab",NA,"canada",NA,NA,NA,"WOS:000281698400023",155,"J","2010","WILEY",2010
"644",644,644,"McAdam, Andrew G.",5,"Univ Guelph, Dept Integrat Biol, Guelph, ON N1G 2W1, Canada.","univ guelph","dept integrat biol"," n1g 2w1","on",NA,"canada",NA,"G-1802-2010","0000-0001-7323-2572","WOS:000281698400023",155,"J","2010","WILEY",2010
"645",645,645,"Fauchald, Per",1,"NINA, Polar Environm Ctr, Arctic Ecol Dept, N-9296 Tromso, Norway.","nina","polar environm ctr","9296"," tromso",NA,"norway",NA,NA,NA,"WOS:000280153500001",156,"J","2010","WILEY",2010
"646",646,646,"Connolly, Rod M.",5,"Griffith Univ, Australian Rivers Inst, Gold Coast Campus, Qld 9726, Australia.","griffith univ","australian rivers inst",NA,"gold coast campus","qld ","australia",NA,"C-4094-2008","0000-0001-6223-1291","WOS:000279563700020",157,"J","2010","WILEY",2010
"647",647,647,"Hindell, Jeremy S.",2,"Arthur Rylah Inst, Dept Sustainabil & Environm, Heidelburg, Vic 3084, Australia.","arthur rylah inst","arthur rylah inst",NA,"heidelburg","vic ","australia",NA,NA,NA,"WOS:000279563700020",157,"J","2010","WILEY",2010
"648",648,648,"Jenkins, Gregory P.",4,"Univ Melbourne, Dept Zool, Parkville, Vic 3010, Australia.","univ melbourne","dept zool",NA,"parkville","vic ","australia",NA,"AAE-9856-2020",NA,"WOS:000279563700020",157,"J","2010","WILEY",2010
"649",649,649,"Keough, Michael J.",3,"Univ Melbourne, Dept Zool, Parkville, Vic 3010, Australia.","univ melbourne","dept zool",NA,"parkville","vic ","australia",NA,NA,NA,"WOS:000279563700020",157,"J","2010","WILEY",2010
"650",650,650,"Macreadie, Peter I.",1,"Univ Melbourne, Dept Zool, Parkville, Vic 3010, Australia.","univ melbourne","dept zool",NA,"parkville","vic ","australia",NA,NA,NA,"WOS:000279563700020",157,"J","2010","WILEY",2010
"651",651,651,"Hamilton, Scott L.",5,"Univ Calif Santa Barbara, Inst Marine Sci, Santa Barbara, CA 93106 USA.","univ calif santa barbara","inst marine sci","93106","santa barbara","ca","usa",NA,NA,NA,"WOS:000279563700010",158,"J","2010","ECOLOGICAL SOC AMER",2010
"652",652,652,"Samhouri, Jameal F.",2,"NOAA Fisheries, NW Fisheries Sci Ctr, Seattle, WA 98112 USA.","noaa fisheries","nw fisheries sci ctr","98112","seattle","wa","usa",NA,NA,NA,"WOS:000279563700010",158,"J","2010","ECOLOGICAL SOC AMER",2010
"653",653,653,"Sandin, Stuart A.",6,"Univ Calif San Diego, Scripps Inst Oceanog, Ctr Marine Biodivers & Conservat, La Jolla, CA 92093 USA.","univ calif san diego","ctr marine biodivers & conservat","92093","la jolla","ca","usa",NA,NA,NA,"WOS:000279563700010",158,"J","2010","ECOLOGICAL SOC AMER",2010
"654",654,74,"Stier, Adrian C.",3,"Univ Florida, Dept Biol, Gainesville, FL 32611 USA.","univ florida","dept biol","32611","gainesville","fl","usa",NA,NA,"0000-0002-4704-4145","WOS:000279563700010",158,"J","2010","ECOLOGICAL SOC AMER",2010
"655",655,655,"White, J. Wilson",1,"Univ Calif Davis, Bodega Marine Lab, Dept Wildlife Fish & Conservat Biol, Bodega Bay, CA 94923 USA.","univ calif davis","dept wildlife fish & conservat biol","94923","bodega bay","ca","usa",NA,NA,NA,"WOS:000279563700010",158,"J","2010","ECOLOGICAL SOC AMER",2010
"656",656,656,"Wormald, Clare L.",4,"Calif State Univ Northridge, Dept Biol, Northridge, CA 91330 USA.","calif state univ northridge","dept biol","91330","northridge","ca","usa",NA,NA,NA,"WOS:000279563700010",158,"J","2010","ECOLOGICAL SOC AMER",2010
"657",657,657,"Cavaleri, Molly A.",1,"Michigan Technol Univ, Sch Forest Resources & Environm Sci, Houghton, MI 49931 USA.","michigan technol univ","sch forest resources & environm sci","49931","houghton","mi","usa",NA,NA,NA,"WOS:000278859700018",159,"J","2010","ECOLOGICAL SOC AMER",2010
"658",658,658,"Clark, Deborah A.",4,"Univ Missouri, Dept Biol, St Louis, MO 63121 USA.","univ missouri","dept biol","63121","st louis","mo","usa",NA,NA,NA,"WOS:000278859700018",159,"J","2010","ECOLOGICAL SOC AMER",2010
"659",659,659,"Clark, David B.",3,"Univ Missouri, Dept Biol, St Louis, MO 63121 USA.","univ missouri","dept biol","63121","st louis","mo","usa",NA,NA,NA,"WOS:000278859700018",159,"J","2010","ECOLOGICAL SOC AMER",2010
"660",660,660,"Oberbauer, Steven F.",2,"Florida Int Univ, Dept Biol Sci, Miami, FL 33199 USA.","florida int univ","dept biol sci","33199","miami","fl","usa",NA,NA,NA,"WOS:000278859700018",159,"J","2010","ECOLOGICAL SOC AMER",2010
"661",661,661,"Ryan, Michael G.",5,"US Forest Serv, USDA, Rocky Mt Res Stn, Ft Collins, CO 80526 USA.","us forest serv","rocky mt res stn","80526","ft collins","co","usa",NA,"A-9805-2008","0000-0002-2500-6738","WOS:000278859700018",159,"J","2010","ECOLOGICAL SOC AMER",2010
"662",662,662,"Fox, Jeremy W.",1,"Univ Calgary, Dept Biol Sci, Calgary, AB T2N 1N4, Canada.","univ calgary","dept biol sci"," t2n 1n4","ab",NA,"canada",NA,NA,NA,"WOS:000278859700022",160,"J","2010","WILEY",2010
"663",663,663,"McCauley, Edward",3,"Univ Calgary, Dept Biol Sci, Calgary, AB T2N 1N4, Canada.","univ calgary","dept biol sci"," t2n 1n4","ab",NA,"canada",NA,NA,NA,"WOS:000278859700022",160,"J","2010","WILEY",2010
"664",664,664,"Nelson, William A.",2,"Queens Univ, Dept Biol, Kingston, ON K7L 3N6, Canada.","queens univ","dept biol"," k7l 3n6","on",NA,"canada",NA,"D-1405-2013",NA,"WOS:000278859700022",160,"J","2010","WILEY",2010
"665",665,665,"Ricklefs, Robert E.",1,"Univ Missouri, Dept Biol, St Louis, MO 63121 USA.","univ missouri","dept biol","63121","st louis","mo","usa",NA,NA,NA,"WOS:000278859700025",161,"J","2010","WILEY",2010
"666",666,666,"Brockhurst, Michael A.",1,"Univ Liverpool, Sch Biol Sci, Liverpool L69 7ZB, Merseyside, England.","univ liverpool","sch biol sci","l69 7zb","liverpool ","merseyside","england",NA,"A-6247-2009","0000-0003-0362-820X","WOS:000275816900004",162,"J","2010","WILEY",2010
"667",667,667,"Buckling, Angus",4,"Univ Oxford, Dept Zool, Oxford OX1 3PS, England.","univ oxford","dept zool","ox1 3ps","oxford ",NA,"england",NA,NA,"0000-0003-1170-4604","WOS:000275816900004",162,"J","2010","WILEY",2010
"668",668,668,"Gardner, Andy",5,"Univ Oxford, Dept Zool, Oxford OX1 3PS, England.","univ oxford","dept zool","ox1 3ps","oxford ",NA,"england",NA,"K-5353-2013","0000-0002-1304-3734","WOS:000275816900004",162,"J","2010","WILEY",2010
"669",669,669,"Habets, Michelle G. J. L.",2,"Univ Liverpool, Sch Biol Sci, Liverpool L69 7ZB, Merseyside, England.","univ liverpool","sch biol sci","l69 7zb","liverpool ","merseyside","england",NA,NA,NA,"WOS:000275816900004",162,"J","2010","WILEY",2010
"670",670,670,"Libberton, Ben",3,"Univ Liverpool, Sch Biol Sci, Liverpool L69 7ZB, Merseyside, England.","univ liverpool","sch biol sci","l69 7zb","liverpool ","merseyside","england",NA,NA,"0000-0001-9104-679X","WOS:000275816900004",162,"J","2010","WILEY",2010
"671",671,671,"Friberg, Magne",1,"Stockholm Univ, Dept Zool, SE-10691 Stockholm, Sweden.","stockholm univ","dept zool","10691"," stockholm",NA,"sweden",NA,NA,NA,"WOS:000275458500004",163,"J","2010","WILEY",2010
"672",672,672,"Wiklund, Christer",2,"Stockholm Univ, Dept Zool, SE-10691 Stockholm, Sweden.","stockholm univ","dept zool","10691"," stockholm",NA,"sweden",NA,NA,NA,"WOS:000275458500004",163,"J","2010","WILEY",2010
"673",673,673,"Bunker, Daniel E.",6,"New Jersey Inst Technol, Dept Biol Sci, Newark, NJ 07102 USA.","new jersey inst technol","dept biol sci","07102","newark","nj","usa",NA,NA,NA,"WOS:000285635100027",164,"J","2010","WILEY",2010
"674",674,674,"Condit, Richard",7,"Smithsonian Trop Res Inst, Balboa, Panama.","smithsonian trop res inst","smithsonian trop res inst",NA,"balboa",NA,"panama",NA,NA,NA,"WOS:000285635100027",164,"J","2010","WILEY",2010
"675",675,675,"Dalling, James W.",8,"Smithsonian Trop Res Inst, Balboa, Panama.","smithsonian trop res inst","smithsonian trop res inst",NA,"balboa",NA,"panama",NA,NA,NA,"WOS:000285635100027",164,"J","2010","WILEY",2010
"676",676,676,"Davies, Stuart J.",9,"Smithsonian Trop Res Inst, Balboa, Panama.","smithsonian trop res inst","smithsonian trop res inst",NA,"balboa",NA,"panama",NA,NA,NA,"WOS:000285635100027",164,"J","2010","WILEY",2010
"677",677,677,"Diaz, Sandra",10,"Univ Nacl Cordoba, Consejo Nacl Invest Cient & Tecn, Inst Multidisciplinario Biol Vegetal, RA-5000 Cordoba, Argentina.","univ nacl cordoba","consejo nacl invest cient & tecn","5000"," cordoba",NA,"argentina",NA,"Q-9804-2018",NA,"WOS:000285635100027",164,"J","2010","WILEY",2010
"678",678,678,"Engelbrecht, Bettina M. J.",11,"Smithsonian Trop Res Inst, Balboa, Panama.","smithsonian trop res inst","smithsonian trop res inst",NA,"balboa",NA,"panama",NA,"E-9914-2012",NA,"WOS:000285635100027",164,"J","2010","WILEY",2010
"679",679,340,"Harms, Kyle E.",12,"Smithsonian Trop Res Inst, Balboa, Panama.","smithsonian trop res inst","smithsonian trop res inst",NA,"balboa",NA,"panama",NA,NA,NA,"WOS:000285635100027",164,"J","2010","WILEY",2010
"680",680,680,"Hubbell, Stephen P.",13,"Smithsonian Trop Res Inst, Balboa, Panama.","smithsonian trop res inst","smithsonian trop res inst",NA,"balboa",NA,"panama",NA,NA,NA,"WOS:000285635100027",164,"J","2010","WILEY",2010
"681",681,188,"Kitajima, Kaoru",2,"Smithsonian Trop Res Inst, Balboa, Panama.","smithsonian trop res inst","smithsonian trop res inst",NA,"balboa",NA,"panama",NA,"M-8521-2018","0000-0001-6822-8536","WOS:000285635100027",164,"J","2010","WILEY",2010
"682",682,188,"Kitajima, Kaoru",2,"Smithsonian Trop Res Inst, Balboa, Panama.","smithsonian trop res inst","smithsonian trop res inst",NA,"balboa",NA,"panama",NA,"E-8877-2012","0000-0001-6822-8536","WOS:000285635100027",164,"J","2010","WILEY",2010
"683",683,683,"Kraft, Nathan J. B.",3,"Univ Calif Berkeley, Dept Integrat Biol, Berkeley, CA 94720 USA.","univ calif berkeley","dept integrat biol","94720","berkeley","ca","usa",NA,"A-2817-2012","0000-0001-8867-7806","WOS:000285635100027",164,"J","2010","WILEY",2010
"684",684,684,"Marks, Christian O.",14,"Univ Minnesota, Dept Ecol Evolut & Behav, St Paul, MN 55108 USA.","univ minnesota","dept ecol evolut & behav","55108","st paul","mn","usa",NA,"F-7403-2012","0000-0002-8936-4753","WOS:000285635100027",164,"J","2010","WILEY",2010
"685",685,237,"Reich, Peter B.",4,"Univ Minnesota, Dept Forest Resources, St Paul, MN 55108 USA.","univ minnesota","dept forest resources","55108","st paul","mn","usa",NA,NA,"0000-0003-4424-662X","WOS:000285635100027",164,"J","2010","WILEY",2010
"686",686,686,"Ruiz-Jaen, Maria C.",15,"McGill Univ, Dept Biol, Montreal, PQ H3A 1B1, Canada.","mcgill univ","dept biol"," h3a 1b1","pq",NA,"canada",NA,"A-3119-2008",NA,"WOS:000285635100027",164,"J","2010","WILEY",2010
"687",687,687,"Salvador, Cristina M.",16,"Santa Fe Bot Garden, Santa Fe, NM 87502 USA.","santa fe bot garden",NA,"87502","santa fe","nm","usa",NA,NA,NA,"WOS:000285635100027",164,"J","2010","WILEY",2010
"688",688,688,"Wright, Ian J.",5,"Macquarie Univ, Dept Biol Sci, Sydney, NSW 2109, Australia.","macquarie univ","dept biol sci",NA,"sydney","nsw ","australia",NA,"G-4979-2012","0000-0001-8338-9143","WOS:000285635100027",164,"J","2010","WILEY",2010
"689",689,689,"Joseph Wright, S.",1,"Smithsonian Trop Res Inst, Balboa, Panama.","smithsonian trop res inst","smithsonian trop res inst",NA,"balboa",NA,"panama",NA,"M-3311-2013","0000-0003-4260-5676","WOS:000285635100027",164,"J","2010","WILEY",2010
"690",690,690,"Zanne, Amy E.",17,"Univ Missouri, Dept Biol, St Louis, MO 63121 USA.","univ missouri","dept biol","63121","st louis","mo","usa",NA,NA,NA,"WOS:000285635100027",164,"J","2010","WILEY",2010
"691",691,691,"Boonstra, Rudy",3,"Univ Toronto Scarborough, Ctr Neurobiol Stress, Toronto, ON M1C 1A4, Canada.","univ toronto scarborough","ctr neurobiol stress"," m1c 1a4","on",NA,"canada",NA,NA,NA,"WOS:000282654700017",165,"J","2010","WILEY",2010
"692",692,641,"Krebs, Charles J.",2,"Univ British Columbia, Dept Zool, Vancouver, BC V6T 1Z4, Canada.","univ british columbia","dept zool"," v6t 1z4","bc",NA,"canada",NA,NA,NA,"WOS:000282654700017",165,"J","2010","WILEY",2010
"693",693,693,"Sheriff, Michael J.",1,"Univ Toronto Scarborough, Ctr Neurobiol Stress, Toronto, ON M1C 1A4, Canada.","univ toronto scarborough","ctr neurobiol stress"," m1c 1a4","on",NA,"canada",NA,NA,NA,"WOS:000282654700017",165,"J","2010","WILEY",2010
"694",694,694,"Fridley, Jason D.",1,"Syracuse Univ, Dept Biol, Syracuse, NY 13244 USA.","syracuse univ","dept biol","13244","syracuse","ny","usa",NA,NA,NA,"WOS:000280153500011",166,"J","2010","ECOLOGICAL SOC AMER",2010
"695",695,695,"Grime, J. Phil",2,"Univ Sheffield, Unit Comparat Plant Ecol, Dept Anim & Plant Sci, Sheffield S10 2TN, S Yorkshire, England.","univ sheffield","unit comparat plant ecol","s10 2tn","sheffield ","s yorkshire","england",NA,NA,NA,"WOS:000280153500011",166,"J","2010","ECOLOGICAL SOC AMER",2010
"696",696,696,"Novak, Mark",1,"Univ Chicago, Dept Ecol & Evolut, Chicago, IL 60637 USA.","univ chicago","dept ecol & evolut","60637","chicago","il","usa",NA,"E-2194-2012","0000-0002-7881-4253","WOS:000280153500023",167,"J","2010","WILEY",2010
"697",697,697,"Aarts, Geert",2,"Royal Netherlands Inst Sea Res NIOZ, Dept Marine Ecol, NL-1790 AB Den Burg, Netherlands.","royal netherlands inst sea res nioz","royal netherlands inst sea res nioz","1790"," ab den burg",NA,"netherlands",NA,"C-5742-2012","0000-0003-3196-4235","WOS:000278859700004",168,"J","2010","ECOLOGICAL SOC AMER",2010
"698",698,698,"Kraan, Casper",1,"Royal Netherlands Inst Sea Res NIOZ, Dept Marine Ecol, NL-1790 AB Den Burg, Netherlands.","royal netherlands inst sea res nioz","royal netherlands inst sea res nioz","1790"," ab den burg",NA,"netherlands",NA,NA,"0000-0003-2062-6222","WOS:000278859700004",168,"J","2010","ECOLOGICAL SOC AMER",2010
"699",699,699,"Piersma, Theunis",4,"Royal Netherlands Inst Sea Res NIOZ, Dept Marine Ecol, NL-1790 AB Den Burg, Netherlands.","royal netherlands inst sea res nioz","royal netherlands inst sea res nioz","1790"," ab den burg",NA,"netherlands",NA,"D-1871-2012",NA,"WOS:000278859700004",168,"J","2010","ECOLOGICAL SOC AMER",2010
"700",700,700,"van der Meer, Jaap",3,"Royal Netherlands Inst Sea Res NIOZ, Dept Marine Ecol, NL-1790 AB Den Burg, Netherlands.","royal netherlands inst sea res nioz","royal netherlands inst sea res nioz","1790"," ab den burg",NA,"netherlands",NA,"C-6687-2011",NA,"WOS:000278859700004",168,"J","2010","ECOLOGICAL SOC AMER",2010
"701",701,701,"Biswas, Shekhar R.",1,"Lakehead Univ, Dept Biol, Thunder Bay, ON P7B 5E1, Canada.","lakehead univ","dept biol"," p7b 5e1","on",NA,"canada",NA,"H-5174-2011","0000-0001-9203-2488","WOS:000275458500006",169,"J","2010","WILEY",2010
"702",702,702,"Mallik, Azim U.",2,"Lakehead Univ, Dept Biol, Thunder Bay, ON P7B 5E1, Canada.","lakehead univ","dept biol"," p7b 5e1","on",NA,"canada",NA,NA,NA,"WOS:000275458500006",169,"J","2010","WILEY",2010
"703",703,703,"LaDeau, Shannon",1,"Cary Inst Ecosyst Studies, Millbrook, NY 12545 USA.","cary inst ecosyst studies",NA,"12545","millbrook","ny","usa",NA,NA,"0000-0003-4825-5435","WOS:000285635100009",170,"J","2010","WILEY",2010
"704",704,704,"Ben-David, Merav",4,"Univ Wyoming, Dept Zool & Physiol, Laramie, WY 82071 USA.","univ wyoming","dept zool & physiol","82071","laramie","wy","usa",NA,NA,NA,"WOS:000284158600007",171,"J","2010","WILEY",2010
"705",705,705,"Meyer, Carolyn B.",2,"Univ Wyoming, Dept Zool & Physiol, Laramie, WY 82071 USA.","univ wyoming","dept zool & physiol","82071","laramie","wy","usa",NA,NA,NA,"WOS:000284158600007",171,"J","2010","WILEY",2010
"706",706,706,"Nibbelink, Nathan P.",3,"Univ Georgia, Warnell Sch Forestry & Nat Resources, Athens, GA 30602 USA.","univ georgia","warnell sch forestry & nat resources","30602","athens","ga","usa",NA,NA,NA,"WOS:000284158600007",171,"J","2010","WILEY",2010
"707",707,707,"Roe, Aaron M.",1,"Univ Wyoming, Dept Bot, Laramie, WY 82071 USA.","univ wyoming","dept bot","82071","laramie","wy","usa",NA,NA,NA,"WOS:000284158600007",171,"J","2010","WILEY",2010
"708",708,708,"Brodie, Jedediah F.",2,"Penn State Univ, Dept Biol, University Pk, PA 16802 USA.","penn state univ","dept biol","16802","university pk","pa","usa",NA,NA,NA,"WOS:000281698400029",172,"J","2010","WILEY",2010
"709",709,709,"Jules, Erik S.",3,"Humboldt State Univ, Dept Biol Sci, Arcata, CA 95521 USA.","humboldt state univ","dept biol sci","95521","arcata","ca","usa",NA,NA,NA,"WOS:000281698400029",172,"J","2010","WILEY",2010
"710",710,710,"Kauffman, Matthew J.",1,"Univ Wyoming, Dept Zool & Physiol, Wyoming Cooperat Fish & Wildlife Res Unit, US Geol Survey, Laramie, WY 82071 USA.","univ wyoming","us geol survey","82071","laramie","wy","usa",NA,NA,NA,"WOS:000281698400029",172,"J","2010","WILEY",2010
"711",711,711,"Roslin, Tomas",2,"Univ Helsinki, Metapopulat Res Grp, Dept Biosci, FI-00014 Helsinki, Finland.","univ helsinki","metapopulat res grp","00014"," hki",NA,"finland",NA,"E-8648-2016","0000-0002-2957-4791","WOS:000280153500009",173,"J","2010","ECOLOGICAL SOC AMER",2010
"712",712,712,"Tack, Ayco J. M.",1,"Univ Helsinki, Metapopulat Res Grp, Dept Biosci, FI-00014 Helsinki, Finland.","univ helsinki","metapopulat res grp","00014"," hki",NA,"finland",NA,"B-7120-2017","0000-0002-3550-1070","WOS:000280153500009",173,"J","2010","ECOLOGICAL SOC AMER",2010
"713",713,713,"Bauer, Silke",1,"Netherlands Inst Ecol NIOO KNAW, NL-3600 BG Maarssen, Netherlands.","netherlands inst ecol nioo knaw","netherlands inst ecol nioo knaw","3600"," bg maarssen",NA,"netherlands",NA,"C-3524-2008","0000-0002-0844-164X","WOS:000278859700026",174,"J","2010","WILEY",2010
"714",714,713,"Bauer, Silke",1,"Netherlands Inst Ecol NIOO KNAW, NL-3600 BG Maarssen, Netherlands.","netherlands inst ecol nioo knaw","netherlands inst ecol nioo knaw","3600"," bg maarssen",NA,"netherlands",NA,"C-3524-2008","0000-0002-0844-164X","WOS:000278859700026",174,"J","2010","WILEY",2010
"715",715,713,"Bauer, Silke",1,"Netherlands Inst Ecol NIOO KNAW, NL-3600 BG Maarssen, Netherlands.","netherlands inst ecol nioo knaw","netherlands inst ecol nioo knaw","3600"," bg maarssen",NA,"netherlands",NA,"M-9811-2019","0000-0002-0844-164X","WOS:000278859700026",174,"J","2010","WILEY",2010
"716",716,713,"Bauer, Silke",1,"Netherlands Inst Ecol NIOO KNAW, NL-3600 BG Maarssen, Netherlands.","netherlands inst ecol nioo knaw","netherlands inst ecol nioo knaw","3600"," bg maarssen",NA,"netherlands",NA,"M-9811-2019","0000-0002-0844-164X","WOS:000278859700026",174,"J","2010","WILEY",2010
"717",717,717,"Ens, Bruno J.",2,"Netherlands Inst Ecol NIOO KNAW, NL-3600 BG Maarssen, Netherlands.","netherlands inst ecol nioo knaw","netherlands inst ecol nioo knaw","3600"," bg maarssen",NA,"netherlands",NA,NA,NA,"WOS:000278859700026",174,"J","2010","WILEY",2010
"718",718,718,"Klaassen, Marcel",3,"Netherlands Inst Ecol NIOO KNAW, NL-3600 BG Maarssen, Netherlands.","netherlands inst ecol nioo knaw","netherlands inst ecol nioo knaw","3600"," bg maarssen",NA,"netherlands",NA,"B-4325-2008","0000-0003-3907-9599","WOS:000278859700026",174,"J","2010","WILEY",2010
"719",719,719,"Brown, Bryan L.",1,"Clemson Univ, Dept Forestry & Nat Resources, Clemson, SC 29634 USA.","clemson univ","dept forestry & nat resources","29634","clemson","sc","usa",NA,"D-9726-2014",NA,"WOS:000278859700024",175,"J","2010","ECOLOGICAL SOC AMER",2010
"720",720,720,"Lawson, Raven L.",2,"Clemson Univ, Dept Forestry & Nat Resources, Clemson, SC 29634 USA.","clemson univ","dept forestry & nat resources","29634","clemson","sc","usa",NA,NA,NA,"WOS:000278859700024",175,"J","2010","ECOLOGICAL SOC AMER",2010
"721",721,721,"Nathan, Ran",2,"Hebrew Univ Jerusalem, Alexander Silberman Inst Life Sci, Dept Evolut Systemat & Ecol, Movement Ecol Lab, IL-91904 Jerusalem, Israel.","hebrew univ jerusalem","alexander silberman inst life sci","91904"," jerusalem",NA,"israel",NA,"A-9380-2008",NA,"WOS:000277867600029",176,"J","2010","WILEY",2010
"722",722,722,"Spiegel, Orr",1,"Hebrew Univ Jerusalem, Alexander Silberman Inst Life Sci, Dept Evolut Systemat & Ecol, Movement Ecol Lab, IL-91904 Jerusalem, Israel.","hebrew univ jerusalem","alexander silberman inst life sci","91904"," jerusalem",NA,"israel",NA,"D-4035-2011","0000-0001-8941-3175","WOS:000277867600029",176,"J","2010","WILEY",2010
"723",723,723,"Anciaes, Marina",4,"Inst Nacl de Pesquisas da Amazonia, Biol Dynam Forest Fragments Project, BR-69011970 Manaus, Amazonas, Brazil.","inst nacl de pesquisas da amazonia","inst nacl de pesquisas da amazonia","69011970"," manaus","amazonas","brazil",NA,"T-2576-2018","0000-0003-2796-3395","WOS:000277867600009",177,"J","2010","WILEY",2010
