"","authorID","groupID","author_name","author_order","address","university","department","postal_code","city","state","country","RP_address","RI","OI","UT","refID","PT","PY","PU","year"
"410",410,410,"van Woesik, R.",4,"Florida Inst Technol, Dept Biol Sci, Melbourne, FL 32901 USA.","florida inst technol","dept biol sci","32901","melbourne","fl","usa",NA,NA,NA,"WOS:000339470500025",100,"J","2014","WILEY",2014
"411",411,411,"Domis, Lisette N. De Senerpont",1,"Netherlands Inst Ecol NIOO KNAW, Dept Aquat Ecol, NL-6708 PB Wageningen, Netherlands.","netherlands inst ecol nioo knaw","netherlands inst ecol nioo knaw","6708"," pb wageningen",NA,"netherlands",NA,NA,NA,"WOS:000337218500008",101,"J","2014","WILEY",2014
"412",412,412,"Helmsing, Nico R.",3,"Netherlands Inst Ecol NIOO KNAW, Dept Aquat Ecol, NL-6708 PB Wageningen, Netherlands.","netherlands inst ecol nioo knaw","netherlands inst ecol nioo knaw","6708"," pb wageningen",NA,"netherlands",NA,NA,NA,"WOS:000337218500008",101,"J","2014","WILEY",2014
"413",413,413,"Mooij, Wolf. M.",5,"Netherlands Inst Ecol NIOO KNAW, Dept Aquat Ecol, NL-6708 PB Wageningen, Netherlands.","netherlands inst ecol nioo knaw","netherlands inst ecol nioo knaw","6708"," pb wageningen",NA,"netherlands",NA,"C-2677-2008","0000-0001-5586-8200","WOS:000337218500008",101,"J","2014","WILEY",2014
"414",414,414,"Van de Waal, Dedmer B.",2,"Netherlands Inst Ecol NIOO KNAW, Dept Aquat Ecol, NL-6708 PB Wageningen, Netherlands.","netherlands inst ecol nioo knaw","netherlands inst ecol nioo knaw","6708"," pb wageningen",NA,"netherlands",NA,"B-8002-2012","0000-0001-8803-1247","WOS:000337218500008",101,"J","2014","WILEY",2014
"415",415,415,"Van Donk, Ellen",4,"Netherlands Inst Ecol NIOO KNAW, Dept Aquat Ecol, NL-6708 PB Wageningen, Netherlands.","netherlands inst ecol nioo knaw","netherlands inst ecol nioo knaw","6708"," pb wageningen",NA,"netherlands",NA,"B-7272-2008","0000-0003-3279-4936","WOS:000337218500008",101,"J","2014","WILEY",2014
"416",416,416,"Harrod, Chris",2,"Max Planck Inst Limnol, Dept Ecol Genet, D-24302 Plon, Germany.","max planck inst limnol","max planck inst limnol","24302"," plon",NA,"germany",NA,"A-8830-2008","0000-0002-5353-1556","WOS:000331429500027",102,"J","2014","WILEY",2014
"417",417,417,"Hayden, Brian",1,"Univ Helsinki, Kilpisjarvi Biol Stn, FI-99490 Kilpisjarvi, Finland.","univ helsinki","kilpisjarvi biol stn","99490"," kilpisjarvi",NA,"finland",NA,NA,NA,"WOS:000331429500027",102,"J","2014","WILEY",2014
"418",418,418,"Kahilainen, Kimmo K.",3,"Univ Helsinki, Kilpisjarvi Biol Stn, FI-99490 Kilpisjarvi, Finland.","univ helsinki","kilpisjarvi biol stn","99490"," kilpisjarvi",NA,"finland",NA,NA,"0000-0002-1539-014X","WOS:000331429500027",102,"J","2014","WILEY",2014
"419",419,419,"Ibanez, Ines",1,"Univ Michigan, Sch Nat Resources & Environm, Ann Arbor, MI 48109 USA.","univ michigan","sch nat resources & environm","48109","ann arbor","mi","usa",NA,NA,NA,"WOS:000331429500011",103,"J","2014","WILEY",2014
"420",420,420,"McCarthy-Neumann, Sarah",2,"Univ Michigan, Sch Nat Resources & Environm, Ann Arbor, MI 48109 USA.","univ michigan","sch nat resources & environm","48109","ann arbor","mi","usa",NA,NA,NA,"WOS:000331429500011",103,"J","2014","WILEY",2014
"421",421,421,"Farquhar, Graham D.",5,"Australian Natl Univ, Res Sch Biol, Canberra, ACT 0200, Australia.","australian natl univ","res sch biol",NA,"canberra","act ","australia",NA,NA,"0000-0002-7065-1971","WOS:000345326000001",104,"J","2014","WILEY",2014
"422",422,422,"Givnish, Thomas J.",1,"Univ Wisconsin, Dept Bot, Madison, WI 53706 USA.","univ wisconsin","dept bot","53706","madison","wi","usa",NA,NA,NA,"WOS:000345326000001",104,"J","2014","WILEY",2014
"423",423,423,"Holloway-Phillips, Meisha",4,"Australian Natl Univ, Res Sch Biol, Canberra, ACT 0200, Australia.","australian natl univ","res sch biol",NA,"canberra","act ","australia",NA,NA,NA,"WOS:000345326000001",104,"J","2014","WILEY",2014
"424",424,424,"Stuart-Williams, Hilary",3,"Australian Natl Univ, Res Sch Biol, Canberra, ACT 0200, Australia.","australian natl univ","res sch biol",NA,"canberra","act ","australia",NA,NA,NA,"WOS:000345326000001",104,"J","2014","WILEY",2014
"425",425,425,"Wong, S. Chin",2,"Australian Natl Univ, Res Sch Biol, Canberra, ACT 0200, Australia.","australian natl univ","res sch biol",NA,"canberra","act ","australia",NA,NA,NA,"WOS:000345326000001",104,"J","2014","WILEY",2014
"426",426,426,"Bento, Ana I.",2,"Univ London Imperial Coll Sci Technol & Med, Sch Publ Hlth, MRC, Ctr Outbreak Anal & Modelling, London W2 1PG, England.","univ london imperial coll sci technol & med","sch publ hlth","w2 1pg","london ",NA,"england",NA,NA,NA,"WOS:000345326000013",105,"J","2014","WILEY",2014
"427",427,427,"Clutton-Brock, Tim H.",3,"Univ Cambridge, Dept Zool, Cambridge CB2 3EJ, England.","univ cambridge","dept zool","cb2 3ej","cambridge ",NA,"england",NA,NA,NA,"WOS:000345326000013",105,"J","2014","WILEY",2014
"428",428,428,"Kruuk, Loeske E. B.",5,"Univ Edinburgh, Sch Biol Sci, Inst Evolutionary Biol, Edinburgh EH9 3JT, Midlothian, Scotland.","univ edinburgh","sch biol sci","eh9 3jt","edinburgh ","midlothian","scotland",NA,"AAB-8714-2019","0000-0001-8588-1123","WOS:000345326000013",105,"J","2014","WILEY",2014
"429",429,428,"Kruuk, Loeske E. B.",5,"Univ Edinburgh, Sch Biol Sci, Inst Evolutionary Biol, Edinburgh EH9 3JT, Midlothian, Scotland.","univ edinburgh","sch biol sci","eh9 3jt","edinburgh ","midlothian","scotland",NA,"AAB-8714-2019","0000-0001-8588-1123","WOS:000345326000013",105,"J","2014","WILEY",2014
"430",430,428,"Kruuk, Loeske E. B.",5,"Univ Edinburgh, Sch Biol Sci, Inst Evolutionary Biol, Edinburgh EH9 3JT, Midlothian, Scotland.","univ edinburgh","sch biol sci","eh9 3jt","edinburgh ","midlothian","scotland",NA,"J-3295-2012","0000-0001-8588-1123","WOS:000345326000013",105,"J","2014","WILEY",2014
"431",431,428,"Kruuk, Loeske E. B.",5,"Univ Edinburgh, Sch Biol Sci, Inst Evolutionary Biol, Edinburgh EH9 3JT, Midlothian, Scotland.","univ edinburgh","sch biol sci","eh9 3jt","edinburgh ","midlothian","scotland",NA,"J-3295-2012","0000-0001-8588-1123","WOS:000345326000013",105,"J","2014","WILEY",2014
"432",432,432,"Pemberton, Josephine M.",4,"Univ Edinburgh, Sch Biol Sci, Inst Evolutionary Biol, Edinburgh EH9 3JT, Midlothian, Scotland.","univ edinburgh","sch biol sci","eh9 3jt","edinburgh ","midlothian","scotland",NA,"F-3100-2010",NA,"WOS:000345326000013",105,"J","2014","WILEY",2014
"433",433,433,"Stopher, Katie V.",1,"Univ Edinburgh, Sch Biol Sci, Inst Evolutionary Biol, Edinburgh EH9 3JT, Midlothian, Scotland.","univ edinburgh","sch biol sci","eh9 3jt","edinburgh ","midlothian","scotland",NA,NA,NA,"WOS:000345326000013",105,"J","2014","WILEY",2014
"434",434,1091,"Gauthier, Gilles",2,"Univ Laval, Dept Biol, Quebec City, PQ G1V 0A6, Canada.","univ laval","dept biol"," g1v 0a6","pq",NA,"canada",NA,NA,NA,"WOS:000344317300008",106,"J","2014","WILEY",2014
"435",435,219,"Pradel, Roger",3,"Univ Paul Valery Montpellier EPHE, Ctr Ecol Fonct & Evolut, UMR 5175, Univ Montpellier, F-34293 Montpellier 05, France.","univ paul valery montpellier ephe","ctr ecol fonct & evolut","34293"," montpellier ",NA,"france",NA,"A-8666-2008","0000-0002-2684-9251","WOS:000344317300008",106,"J","2014","WILEY",2014
"436",436,436,"Souchay, Guillaume",1,"Univ Laval, Dept Biol, Quebec City, PQ G1V 0A6, Canada.","univ laval","dept biol"," g1v 0a6","pq",NA,"canada",NA,NA,NA,"WOS:000344317300008",106,"J","2014","WILEY",2014
"437",437,437,"Asnaghi, Valentina",9,"Univ Genova DiSTAV, I-16132 Genoa, Italy.","univ genova distav",NA,"16132"," genoa",NA,"italy",NA,NA,"0000-0003-1659-2613","WOS:000337218500003",107,"J","2014","WILEY",2014
"438",438,438,"Chiantore, Mariachiara",8,"Univ Genova DiSTAV, I-16132 Genoa, Italy.","univ genova distav",NA,"16132"," genoa",NA,"italy",NA,NA,NA,"WOS:000337218500003",107,"J","2014","WILEY",2014
"439",439,439,"De Juan, Silvia",10,"Natl Inst Water & Atmospher Res, Hamilton 3251, New Zealand.","natl inst water & atmospher res","natl inst water & atmospher res",NA,"hamilton ",NA,"new zealand",NA,NA,"0000-0002-8891-8371","WOS:000337218500003",107,"J","2014","WILEY",2014
"440",440,440,"Hewitt, Judi E.",2,"Natl Inst Water & Atmospher Res, Hamilton 3251, New Zealand.","natl inst water & atmospher res","natl inst water & atmospher res",NA,"hamilton ",NA,"new zealand",NA,NA,NA,"WOS:000337218500003",107,"J","2014","WILEY",2014
"441",441,441,"Kraan, Casper",11,"Natl Inst Water & Atmospher Res, Hamilton 3251, New Zealand.","natl inst water & atmospher res","natl inst water & atmospher res",NA,"hamilton ",NA,"new zealand",NA,NA,"0000-0003-2062-6222","WOS:000337218500003",107,"J","2014","WILEY",2014
"442",442,442,"Lohrer, Andrew M.",4,"Natl Inst Water & Atmospher Res, Hamilton 3251, New Zealand.","natl inst water & atmospher res","natl inst water & atmospher res",NA,"hamilton ",NA,"new zealand",NA,NA,NA,"WOS:000337218500003",107,"J","2014","WILEY",2014
"443",443,443,"Parkes, Samantha",3,"Natl Inst Water & Atmospher Res, Hamilton 3251, New Zealand.","natl inst water & atmospher res","natl inst water & atmospher res",NA,"hamilton ",NA,"new zealand",NA,NA,NA,"WOS:000337218500003",107,"J","2014","WILEY",2014
"444",444,444,"Pilditch, Conrad",5,"Univ Waikato, Dept Biol Sci, Hamilton 3216, New Zealand.","univ waikato",NA,NA,"dept biol sci","hamilton ","new zealand",NA,NA,NA,"WOS:000337218500003",107,"J","2014","WILEY",2014
"445",445,445,"Rodil, Ivan",12,"Natl Inst Water & Atmospher Res, Hamilton 3251, New Zealand.","natl inst water & atmospher res","natl inst water & atmospher res",NA,"hamilton ",NA,"new zealand",NA,"I-5305-2013","0000-0001-6375-1598","WOS:000337218500003",107,"J","2014","WILEY",2014
"446",446,446,"Savage, Candida",13,"Univ Otago, Dept Marine Sci, Dunedin 9054, New Zealand.","univ otago",NA,NA,"dept marine sci","dunedin ","new zealand",NA,NA,NA,"WOS:000337218500003",107,"J","2014","WILEY",2014
"447",447,447,"Thrush, Simon F.",1,"Natl Inst Water & Atmospher Res, Hamilton 3251, New Zealand.","natl inst water & atmospher res","natl inst water & atmospher res",NA,"hamilton ",NA,"new zealand",NA,NA,"0000-0002-4005-3882","WOS:000337218500003",107,"J","2014","WILEY",2014
"448",448,448,"Van Colen, Carl",14,"Univ Ghent, Marine Biol Sect, Dept Biol, B-9000 Ghent, Belgium.","univ ghent","marine biol sect","9000"," ghent",NA,"belgium",NA,NA,NA,"WOS:000337218500003",107,"J","2014","WILEY",2014
"449",449,449,"Wethey, David S.",7,"Univ S Carolina, Dept Biol Sci, Columbia, SC 29208 USA.","univ s carolina","dept biol sci","29208","columbia","sc","usa",NA,"K-8063-2014","0000-0002-2549-1606","WOS:000337218500003",107,"J","2014","WILEY",2014
"450",450,450,"Woodin, Sarah A.",6,"Univ S Carolina, Dept Biol Sci, Columbia, SC 29208 USA.","univ s carolina","dept biol sci","29208","columbia","sc","usa",NA,"K-8481-2014","0000-0001-5615-2212","WOS:000337218500003",107,"J","2014","WILEY",2014
"451",451,451,"Chang, Chun-Wei",1,"Acad Sinica, TIGP, Earth Syst Sci Program, Taipei 11529, Taiwan.","acad sinica","tigp"," 11529","taipei",NA,"taiwan",NA,NA,NA,"WOS:000334573600010",108,"J","2014","WILEY",2014
"452",452,389,"Hsieh, Chih-Hao",7,"Natl Taiwan Univ, Inst Oceanog, Taipei 10617, Taiwan.","natl taiwan univ","inst oceanog"," 10617","taipei",NA,"taiwan",NA,"B-3797-2008","0000-0001-5935-7272","WOS:000334573600010",108,"J","2014","WILEY",2014
"453",453,453,"Kao, Shuh-ji",4,"Acad Sinica, TIGP, Earth Syst Sci Program, Taipei 11529, Taiwan.","acad sinica","tigp"," 11529","taipei",NA,"taiwan",NA,"F-8418-2015","0000-0002-5054-9099","WOS:000334573600010",108,"J","2014","WILEY",2014
"454",454,393,"Miki, Takeshi",2,"Natl Taiwan Univ, Inst Oceanog, Taipei 10617, Taiwan.","natl taiwan univ","inst oceanog"," 10617","taipei",NA,"taiwan",NA,"F-8189-2010","0000-0002-2452-8681","WOS:000334573600010",108,"J","2014","WILEY",2014
"455",455,455,"Sastri, Akash R.",6,"Natl Taiwan Univ, Inst Oceanog, Taipei 10617, Taiwan.","natl taiwan univ","inst oceanog"," 10617","taipei",NA,"taiwan",NA,"D-7798-2013","0000-0001-8075-0917","WOS:000334573600010",108,"J","2014","WILEY",2014
"456",456,456,"Shiah, Fuh-Kwo",3,"Acad Sinica, TIGP, Earth Syst Sci Program, Taipei 11529, Taiwan.","acad sinica","tigp"," 11529","taipei",NA,"taiwan",NA,NA,NA,"WOS:000334573600010",108,"J","2014","WILEY",2014
"457",457,457,"Wu, Jiunn-Tzong",5,"Acad Sinica, Biodivers Res Ctr, Taipei 11529, Taiwan.","acad sinica","biodivers res ctr"," 11529","taipei",NA,"taiwan",NA,NA,NA,"WOS:000334573600010",108,"J","2014","WILEY",2014
"458",458,458,"Bastow, Justin L.",5,"Eastern Washington Univ, Dept Biol, Cheney, WA 99004 USA.","eastern washington univ","dept biol","99004","cheney","wa","usa",NA,NA,NA,"WOS:000331429500013",109,"J","2014","WILEY",2014
"459",459,459,"Crutsinger, Gregory M.",1,"Univ British Columbia, Dept Zool, Vancouver, BC V6T 1Z4, Canada.","univ british columbia","dept zool"," v6t 1z4","bc",NA,"canada",NA,NA,NA,"WOS:000331429500013",109,"J","2014","WILEY",2014
"460",460,460,"Dawson, Todd E.",7,"Univ Calif Berkeley, Dept Integrat Biol, Berkeley, CA 94720 USA.","univ calif berkeley","dept integrat biol","94720","berkeley","ca","usa",NA,NA,NA,"WOS:000331429500013",109,"J","2014","WILEY",2014
"461",461,461,"Fine, Paul V. A.",8,"Univ Calif Berkeley, Dept Integrat Biol, Berkeley, CA 94720 USA.","univ calif berkeley","dept integrat biol","94720","berkeley","ca","usa",NA,NA,"0000-0002-0550-5628","WOS:000331429500013",109,"J","2014","WILEY",2014
"462",462,462,"Kidder, Allison G.",6,"Univ Calif Berkeley, Dept Integrat Biol, Berkeley, CA 94720 USA.","univ calif berkeley","dept integrat biol","94720","berkeley","ca","usa",NA,NA,NA,"WOS:000331429500013",109,"J","2014","WILEY",2014
"463",463,463,"Peay, Kabir G.",4,"Stanford Univ, Dept Biol, Stanford, CA 94305 USA.","stanford univ","dept biol","94305","stanford","ca","usa",NA,NA,"0000-0002-7998-7412","WOS:000331429500013",109,"J","2014","WILEY",2014
"464",464,464,"Roddy, Adam B.",3,"Univ Calif Berkeley, Dept Integrat Biol, Berkeley, CA 94720 USA.","univ calif berkeley","dept integrat biol","94720","berkeley","ca","usa",NA,"M-4523-2013","0000-0002-4423-8729","WOS:000331429500013",109,"J","2014","WILEY",2014
"465",465,465,"Rodriguez-Cabal, Mariano A.",2,"Univ British Columbia, Dept Zool, Vancouver, BC V6T 1Z4, Canada.","univ british columbia","dept zool"," v6t 1z4","bc",NA,"canada",NA,NA,NA,"WOS:000331429500013",109,"J","2014","WILEY",2014
"466",466,281,"Rudgers, Jennifer A.",9,"Univ New Mexico, Dept Biol, Albuquerque, NM 87131 USA.","univ new mexico","dept biol","87131","albuquerque","nm","usa",NA,NA,NA,"WOS:000331429500013",109,"J","2014","WILEY",2014
"467",467,467,"Haavisto, Fiia",1,"Univ Turku, Dept Biol, Sect Ecol, FIN-20014 Turku, Finland.","univ turku","dept biol","20014","f turku",NA,"finland",NA,NA,NA,"WOS:000345326000005",110,"J","2014","WILEY",2014
"468",468,468,"Jormalainen, Veijo",2,"Univ Turku, Dept Biol, Sect Ecol, FIN-20014 Turku, Finland.","univ turku","dept biol","20014","f turku",NA,"finland",NA,"B-2073-2008","0000-0001-6346-2585","WOS:000345326000005",110,"J","2014","WILEY",2014
"469",469,469,"Lukas, Marcus",1,"Univ Potsdam, Inst Biochem & Biol, Dept Ecol & Ecosyst Modeling, D-14469 Potsdam, Germany.","univ potsdam","inst biochem & biol","14469"," potsdam",NA,"germany",NA,NA,NA,"WOS:000345326000008",111,"J","2014","ECOLOGICAL SOC AMER",2014
"470",470,470,"Wacker, Alexander",2,"Univ Potsdam, Inst Biochem & Biol, Dept Ecol & Ecosyst Modeling, D-14469 Potsdam, Germany.","univ potsdam","inst biochem & biol","14469"," potsdam",NA,"germany",NA,"I-8277-2012","0000-0001-9687-6477","WOS:000345326000008",111,"J","2014","ECOLOGICAL SOC AMER",2014
"471",471,471,"Lynch, Heather J.",1,"SUNY Stony Brook, Dept Ecol & Evolut, Stony Brook, NY 11794 USA.","suny stony brook","dept ecol & evolut","11794","stony brook","ny","usa",NA,NA,NA,"WOS:000345326000017",112,"J","2014","WILEY",2014
"472",472,472,"Shelton, Andrew Olaf",3,"NOAA, Conservat Biol Div, NW Fisheries Sci Ctr, Natl Marine Fisheries Serv, Seattle, WA 98112 USA.","noaa","natl marine fisheries serv","98112","seattle","wa","usa",NA,NA,NA,"WOS:000345326000017",112,"J","2014","WILEY",2014
"473",473,293,"Thorson, James T.",2,"NOAA, Fisheries Resource & Monitoring Div, NW Fisheries Sci Ctr, Natl Marine Fisheries Serv, Seattle, WA 98112 USA.","noaa","natl marine fisheries serv","98112","seattle","wa","usa",NA,"H-8771-2019","0000-0001-7415-1010","WOS:000345326000017",112,"J","2014","WILEY",2014
"474",474,293,"Thorson, James T.",2,"NOAA, Fisheries Resource & Monitoring Div, NW Fisheries Sci Ctr, Natl Marine Fisheries Serv, Seattle, WA 98112 USA.","noaa","natl marine fisheries serv","98112","seattle","wa","usa",NA,"H-8771-2019","0000-0001-7415-1010","WOS:000345326000017",112,"J","2014","WILEY",2014
"475",475,293,"Thorson, James T.",2,"NOAA, Fisheries Resource & Monitoring Div, NW Fisheries Sci Ctr, Natl Marine Fisheries Serv, Seattle, WA 98112 USA.","noaa","natl marine fisheries serv","98112","seattle","wa","usa",NA,"O-7937-2014","0000-0001-7415-1010","WOS:000345326000017",112,"J","2014","WILEY",2014
"476",476,293,"Thorson, James T.",2,"NOAA, Fisheries Resource & Monitoring Div, NW Fisheries Sci Ctr, Natl Marine Fisheries Serv, Seattle, WA 98112 USA.","noaa","natl marine fisheries serv","98112","seattle","wa","usa",NA,"O-7937-2014","0000-0001-7415-1010","WOS:000345326000017",112,"J","2014","WILEY",2014
"477",477,477,"Anstett, Daniel N.",1,"Univ Toronto, Dept Ecol & Evolutionary Biol, Toronto, ON M5S 3B2, Canada.","univ toronto","dept ecol & evolutionary biol"," m5s 3b2","on",NA,"canada",NA,NA,NA,"WOS:000344317300023",113,"J","2014","WILEY",2014
"478",478,478,"Johnson, Marc T. J.",3,"Univ Toronto, Dept Ecol & Evolutionary Biol, Toronto, ON M5S 3B2, Canada.","univ toronto","dept ecol & evolutionary biol"," m5s 3b2","on",NA,"canada",NA,NA,NA,"WOS:000344317300023",113,"J","2014","WILEY",2014
"479",479,479,"Naujokaitis-Lewis, Ilona",2,"Univ Toronto, Dept Ecol & Evolutionary Biol, Toronto, ON M5S 3B2, Canada.","univ toronto","dept ecol & evolutionary biol"," m5s 3b2","on",NA,"canada",NA,NA,NA,"WOS:000344317300023",113,"J","2014","WILEY",2014
"480",480,549,"Miller, Tom E. X.",2,"Rice Univ, Dept Ecol & Evolutionary Biol, Houston, TX 77005 USA.","rice univ","dept ecol & evolutionary biol","77005","houston","tx","usa",NA,NA,NA,"WOS:000344317300024",114,"J","2014","WILEY",2014
"481",481,481,"Ohm, Johanna R.",1,"Rice Univ, Dept Ecol & Evolutionary Biol, Houston, TX 77005 USA.","rice univ","dept ecol & evolutionary biol","77005","houston","tx","usa",NA,"W-3213-2019","0000-0002-5609-3328","WOS:000344317300024",114,"J","2014","WILEY",2014
"482",482,482,"Bellingham, Peter J.",5,"Landcare Res, Lincoln 7640, New Zealand.","landcare res",NA,NA,"lincoln ",NA,"new zealand",NA,"AAP-4302-2020",NA,"WOS:000344317300029",115,"J","2014","ECOLOGICAL SOC AMER",2014
"483",483,483,"Healey, John R.",3,"Bangor Univ, Sch Environm Nat Resources & Geog, Bangor LL57 2UW, Gwynedd, Wales.","bangor univ","sch environm nat resources & geog","ll57 2uw","bangor ","gwynedd","wales",NA,"J-3719-2016","0000-0002-5398-2293","WOS:000344317300029",115,"J","2014","ECOLOGICAL SOC AMER",2014
"484",484,484,"Holdaway, Robert J.",4,"Landcare Res, Lincoln 7640, New Zealand.","landcare res",NA,NA,"lincoln ",NA,"new zealand",NA,NA,NA,"WOS:000344317300029",115,"J","2014","ECOLOGICAL SOC AMER",2014
"485",485,485,"Rodriguez-Sanchez, Francisco",2,"Univ Cambridge, Dept Plant Sci, Cambridge CB2 3EA, England.","univ cambridge","dept plant sci","cb2 3ea","cambridge ",NA,"england",NA,"A-9307-2008","0000-0002-7981-1599","WOS:000344317300029",115,"J","2014","ECOLOGICAL SOC AMER",2014
"486",486,486,"Tanner, Edmund V. J.",1,"Univ Cambridge, Dept Plant Sci, Cambridge CB2 3EA, England.","univ cambridge","dept plant sci","cb2 3ea","cambridge ",NA,"england",NA,NA,NA,"WOS:000344317300029",115,"J","2014","ECOLOGICAL SOC AMER",2014
"487",487,487,"Campbell, Colin",2,"Penn State Univ, Dept Biol, University Pk, PA 16802 USA.","penn state univ","dept biol","16802","university pk","pa","usa",NA,NA,NA,"WOS:000344317300002",116,"J","2014","ECOLOGICAL SOC AMER",2014
"488",488,488,"Shea, Katriona",3,"Penn State Univ, Dept Biol, University Pk, PA 16802 USA.","penn state univ","dept biol","16802","university pk","pa","usa",NA,"B-7954-2008","0000-0002-7607-8248","WOS:000344317300002",116,"J","2014","ECOLOGICAL SOC AMER",2014
"489",489,489,"Teller, Brittany J.",1,"Penn State Univ, Dept Biol, University Pk, PA 16802 USA.","penn state univ","dept biol","16802","university pk","pa","usa",NA,NA,"0000-0001-8368-875X","WOS:000344317300002",116,"J","2014","ECOLOGICAL SOC AMER",2014
"490",490,490,"Steiner, Christopher F.",1,"Wayne State Univ, Dept Biol Sci, Detroit, MI 48202 USA.","wayne state univ","dept biol sci","48202","detroit","mi","usa",NA,NA,NA,"WOS:000342340200022",117,"J","2014","ECOLOGICAL SOC AMER",2014
"491",491,491,"Baskett, Marissa L.",4,"Univ Calif Davis, Dept Environm Sci & Policy, Davis, CA 95616 USA.","univ calif davis","dept environm sci & policy","95616","davis","ca","usa",NA,"P-1762-2014","0000-0001-6102-1110","WOS:000340215900025",118,"J","2014","ECOLOGICAL SOC AMER",2014
"492",492,492,"Castorani, Max C. N.",1,"San Diego State Univ, Coastal & Marine Inst Lab, San Diego, CA 92182 USA.","san diego state univ","coastal & marine inst lab","92182","san diego","ca","usa",NA,NA,"0000-0002-7372-9359","WOS:000340215900025",118,"J","2014","ECOLOGICAL SOC AMER",2014
"493",493,493,"Hovel, Kevin A.",2,"San Diego State Univ, Coastal & Marine Inst Lab, San Diego, CA 92182 USA.","san diego state univ","coastal & marine inst lab","92182","san diego","ca","usa",NA,NA,NA,"WOS:000340215900025",118,"J","2014","ECOLOGICAL SOC AMER",2014
"494",494,494,"Williams, Susan L.",3,"Univ Calif Davis, Bodega Marine Lab, Bodega Bay, CA 94923 USA.","univ calif davis","bodega marine lab","94923","bodega bay","ca","usa",NA,NA,NA,"WOS:000340215900025",118,"J","2014","ECOLOGICAL SOC AMER",2014
"495",495,495,"Glynn, Peter W.",2,"Univ Miami, Rosenstiel Sch Marine & Atmospher Sci, Miami, FL 33149 USA.","univ miami","rosenstiel sch marine & atmospher sci","33149","miami","fl","usa",NA,NA,NA,"WOS:000337218500024",119,"J","2014","WILEY",2014
"496",496,496,"Gyory, Joanna",5,"Univ Virgin Isl, Ctr Marine & Environm Studies, St Thomas, VI 00802 USA.","univ virgin isl","ctr marine & environm studies","00802","st thomas","vi","usa",NA,NA,NA,"WOS:000337218500024",119,"J","2014","WILEY",2014
"497",497,497,"Mate, Juan L.",3,"Smithsonian Trop Res Inst, Panama City, Panama.","smithsonian trop res inst","smithsonian trop res inst",NA,"panama city",NA,"panama",NA,NA,NA,"WOS:000337218500024",119,"J","2014","WILEY",2014
"498",498,498,"Smith, Tyler B.",1,"Univ Virgin Isl, Ctr Marine & Environm Studies, St Thomas, VI 00802 USA.","univ virgin isl","ctr marine & environm studies","00802","st thomas","vi","usa",NA,NA,NA,"WOS:000337218500024",119,"J","2014","WILEY",2014
"499",499,499,"Toth, Lauren T.",4,"Florida Inst Technol, Melbourne, FL 32901 USA.","florida inst technol",NA,"32901","melbourne","fl","usa",NA,NA,"0000-0002-2568-802X","WOS:000337218500024",119,"J","2014","WILEY",2014
"500",500,500,"Genovart, Meritxell",4,"CSIC UIB, Inst Mediterrani Estudis Avancats IMEDEA, Populat Ecol Grp, Esporles 07190, Mallorca, Spain.","csic uib","inst mediterrani estudis avancats imedea"," 07190","esporles","mallorca","spain",NA,"L-4873-2014","0000-0003-2919-1288","WOS:000331429500018",120,"J","2014","WILEY",2014
"501",501,501,"Hernandez, Noelia",2,"CSIC UIB, Inst Mediterrani Estudis Avancats IMEDEA, Populat Ecol Grp, Esporles 07190, Mallorca, Spain.","csic uib","inst mediterrani estudis avancats imedea"," 07190","esporles","mallorca","spain",NA,NA,NA,"WOS:000331429500018",120,"J","2014","WILEY",2014
"502",502,502,"Jover, Lluis",3,"Univ Barcelona, Unitat Bioestadist, Dept Salut Publ, E-08036 Barcelona, Spain.","univ barcelona","unitat bioestadist","08036"," barcelona",NA,"spain",NA,"D-2192-2011","0000-0003-0631-1398","WOS:000331429500018",120,"J","2014","WILEY",2014
"503",503,503,"Oro, Daniel",1,"CSIC UIB, Inst Mediterrani Estudis Avancats IMEDEA, Populat Ecol Grp, Esporles 07190, Mallorca, Spain.","csic uib","inst mediterrani estudis avancats imedea"," 07190","esporles","mallorca","spain",NA,"H-4208-2012","0000-0003-4782-3007","WOS:000331429500018",120,"J","2014","WILEY",2014
"504",504,504,"Bullock, James M.",4,"NERC Ctr Ecol & Hydrol, Wallingford OX10 8BB, Oxon, England.","nerc ctr ecol & hydrol",NA,"ox10 8bb","wallingford ","oxon","england",NA,"F-9997-2011",NA,"WOS:000331429500024",121,"J","2014","WILEY",2014
"505",505,505,"Goetzenberger, Lars",2,"Univ Tartu, Inst Ecol & Earth Sci, EE-51005 Tartu, Estonia.","univ tartu","inst ecol & earth sci","51005"," tartu",NA,"estonia",NA,"H-1587-2014","0000-0003-3040-2900","WOS:000331429500024",121,"J","2014","WILEY",2014
"506",506,506,"Hooftman, Danny A. P.",5,"NERC Ctr Ecol & Hydrol, Wallingford OX10 8BB, Oxon, England.","nerc ctr ecol & hydrol",NA,"ox10 8bb","wallingford ","oxon","england",NA,NA,"0000-0001-9835-6897","WOS:000331429500024",121,"J","2014","WILEY",2014
"507",507,507,"Kaasik, Ants",6,"Univ Tartu, Inst Ecol & Earth Sci, EE-51014 Tartu, Estonia.","univ tartu","inst ecol & earth sci","51014"," tartu",NA,"estonia",NA,"H-2462-2012","0000-0002-4904-0877","WOS:000331429500024",121,"J","2014","WILEY",2014
"508",508,508,"Paertel, Meelis",7,"Univ Tartu, Inst Ecol & Earth Sci, EE-51005 Tartu, Estonia.","univ tartu","inst ecol & earth sci","51005"," tartu",NA,"estonia",NA,"D-5493-2012","0000-0002-5874-0138","WOS:000331429500024",121,"J","2014","WILEY",2014
"509",509,509,"Tamme, Riin",1,"Univ Tartu, Inst Ecol & Earth Sci, EE-51005 Tartu, Estonia.","univ tartu","inst ecol & earth sci","51005"," tartu",NA,"estonia",NA,NA,NA,"WOS:000331429500024",121,"J","2014","WILEY",2014
